{
  "schemaVersion": 1,
  "authority": "PRODUCT.md",
  "product": {
    "name": "The Ascent of Karl",
    "promise": "Shape Karl's journey through what you combine, collect the history and fates you uncover, and hear the narrator turn every success and disaster into his story.",
    "primaryPurpose": "An interactive story where combining is how the player chooses what Karl tries, discovers, invents, solves, and becomes.",
    "northStar": "Authored-content completion percentage across archived lives.",
    "completionDefinition": [
      "Canonical discoveries count.",
      "Major authored story branches count.",
      "Authored fates and endings count.",
      "Generated inventions do not enter the denominator; authored consequences they unlock count."
    ],
    "hardBoundaries": [
      "Implementation may proceed across approved targets, but no target behavior is `production` until its advancement gate passes.",
      "The product is entertainment, not curriculum or assessment.",
      "Historical claims require curated canonical content and verified sources.",
      "Generated graphs and implementation evidence never override human product authority.",
      "Accessibility is a release gate across every capability.",
      "Current truth and approved target must remain explicitly separate."
    ],
    "openDecisions": [
      "Monetisation model.",
      "Final voice production method.",
      "Production model provider and hosting architecture.",
      "Numerical thresholds before measured playtest baselines.",
      "Long-term breadth of open-ended sandbox play."
    ],
    "crossCutting": {
      "collectionRecordsStory": "Collection is the visible record of the story the player authored.",
      "narratorThreeDimensions": "Humour, guidance, and the account of who Karl becomes are equally required narrator outcomes.",
      "history": "Historical logic makes the story world credible; generated inventions carry no historical claim.",
      "karl": "Karl is the recognisable comic mascot, visibly marked by accumulated choices.",
      "accessibility": "Equivalent information and action channels plus WCAG AA gate every capability.",
      "sandbox": "Open-ended experimentation is a secondary objective integrated into authored progression.",
      "generatedGameplay": "Models propose typed run-local gameplay; deterministic validation owns truth and effects.",
      "onlineTarget": "Active play may become online-required only after the production-readiness gate.",
      "svelteParity": "The post-playtest Svelte replacement preserves behavior, semantics, visuals, accessibility, events, and saves before redesign."
    },
    "currentArchitecture": [
      "TypeScript and Vite with a deterministic content-driven core.",
      "Svelte 5 owns the semantic DOM shell while the existing controller preserves behavior and side-effect ordering.",
      "Seeded LifePlans, ProfileV2 archives, authored compendium, replay targets, and typed local product events are implemented.",
      "Worker source includes run/session APIs, HMAC+CSRF capabilities, revisioned idempotent attempts, and bounded generated-gameplay selection.",
      "Public Pages builds keep online-required and Worker endpoints off until production readiness is externally established."
    ],
    "targetArchitecture": [
      "Product truth infrastructure precedes and governs player-facing changes.",
      "Replace the UI with Svelte in one coordinated migration now.",
      "Generated gameplay remains typed, deterministic-validated, run-local, and historically non-authoritative.",
      "Active play becomes online-required only after backend production readiness.",
      "Typed product events remain local until telemetry hosting and consent are approved."
    ],
    "authorityAnchors": [
      "Shape Karl's journey through what you combine, collect the history and fates you uncover, and hear the narrator turn every success and disaster into his story.",
      "The Ascent of Karl is an **interactive story**.",
      "The product north star is the player's **authored-content completion percentage**",
      "The narrator's humour, guidance, and account of who Karl becomes are equally important.",
      "The approved target is online-required active play.",
      "Martin explicitly lifted the pre-playtest implementation freeze on 2026-08-16.",
      "Implementation may proceed across approved targets, but no target behavior is `production` until its advancement gate passes."
    ]
  },
  "lifecycleStates": [
    "proposed",
    "approved-target",
    "implementing",
    "playtest",
    "production",
    "retired"
  ],
  "capabilities": [
    {
      "id": "life.begin",
      "name": "Begin a life",
      "purpose": "Start one distinct archived Karl life and reach meaningful play quickly.",
      "playerOutcome": "The player understands the available starting possibilities and begins a viable but meaningfully varied life.",
      "currentTruth": "New, continue, and restart flows use a stored deterministic LifePlan with five starting elements, two authored sidequests, two challenges, and exhaustively validated opening witnesses.",
      "approvedTarget": "A stored deterministic seed selects a bounded starting subset and sidequests while guaranteeing viable authored progression.",
      "qualitativeAcceptance": [
        "Players notice that a new life differs.",
        "Players understand the starting possibilities without explanation.",
        "Every generated seed retains a viable authored path."
      ],
      "lifecycle": {
        "current": "production",
        "target": "implementing",
        "advancementGate": "Define and exhaustively verify seeded starting-pool and sidequest viability before implementation."
      },
      "dependencies": [],
      "semanticEvents": [
        "life.started"
      ],
      "ownershipHints": {
        "sourceEntrypoints": [
          "src/ui/main.ts",
          "src/core/engine.ts",
          "src/core/save.ts"
        ],
        "contentEntrypoints": [
          "content/elements.json",
          "content/challenges.json"
        ],
        "testEntrypoints": [
          "tests/title-screen.test.ts",
          "tests/engine.test.ts",
          "tests/scenario.test.ts"
        ]
      },
      "searchTerms": [
        "new life",
        "start",
        "continue",
        "seed",
        "starting elements",
        "sidequests"
      ]
    },
    {
      "id": "craft.combine",
      "name": "Choose and combine",
      "purpose": "Give the player the primary language for deciding what Karl tries.",
      "playerOutcome": "A selected pair produces a meaningful result, reaction, consequence, or clue.",
      "currentTruth": "The player selects two elements. Canonical recipes win; otherwise local compatibility returns a specific verdict and optional bounded invention, while online mode commits through a revisioned authoritative run.",
      "approvedTarget": "Every valid attempt produces meaningful yield: a new outcome or a specific humour, guidance, or story response.",
      "qualitativeAcceptance": [
        "Most valid attempts produce meaningful yield.",
        "Generic silence never follows an attempt.",
        "The player can distinguish result, reaction, and next possibility."
      ],
      "lifecycle": {
        "current": "production",
        "target": "implementing",
        "advancementGate": "External playtest must establish where attempts still feel empty or arbitrary."
      },
      "dependencies": [
        "life.begin"
      ],
      "semanticEvents": [
        "combination.attempted"
      ],
      "ownershipHints": {
        "sourceEntrypoints": [
          "src/core/engine.ts",
          "src/core/verdict.ts",
          "src/ui/main.ts"
        ],
        "contentEntrypoints": [
          "content/combos.json",
          "content/elements.json"
        ],
        "testEntrypoints": [
          "tests/engine.test.ts",
          "tests/verdict.test.ts",
          "tests/pairs.test.ts"
        ]
      },
      "searchTerms": [
        "combine",
        "combining",
        "combination",
        "attempt",
        "pair",
        "yield",
        "nofuse"
      ]
    },
    {
      "id": "collection.canonical-discovery",
      "name": "Canonical discovery",
      "purpose": "Deliver a collectible authored story milestone that expands future possibilities.",
      "playerOutcome": "The player recognises a new canonical result, sees collection progress, and understands that the world has expanded.",
      "currentTruth": "Canonical discoveries carry authored effects and now update both the active life record and finite persistent completion.",
      "approvedTarget": "The discovery's newness, future utility, Chronicle entry, and persistent completion effect are immediately legible.",
      "qualitativeAcceptance": [
        "Players recognise the result as new.",
        "Players understand that it expands future possibilities.",
        "Visible collection progress feels valuable."
      ],
      "lifecycle": {
        "current": "production",
        "target": "implementing",
        "advancementGate": "The dual collection model must define canonical completion and save compatibility."
      },
      "dependencies": [
        "craft.combine"
      ],
      "semanticEvents": [
        "discovery.canonical"
      ],
      "ownershipHints": {
        "sourceEntrypoints": [
          "src/core/engine.ts",
          "src/ui/story-page.ts",
          "src/ui/book.ts"
        ],
        "contentEntrypoints": [
          "content/elements.json",
          "content/combos.json"
        ],
        "testEntrypoints": [
          "tests/engine.test.ts",
          "tests/story-page.test.ts",
          "tests/rarity.test.ts"
        ]
      },
      "searchTerms": [
        "canonical",
        "discovery",
        "historical note",
        "collection",
        "rarity"
      ]
    },
    {